
         /\      Grafana   /‾‾/  
    /\  /  \     |\  __   /  /   
   /  \/    \    | |/ /  /   ‾‾\ 
  /          \   |   (  |  (‾)  |
 / __________ \  |_|\_\  \_____/ 

     execution: local
        script: tests/load-test.js
        output: -

     scenarios: (100.00%) 1 scenario, 10 max VUs, 40s max duration (incl. graceful stop):
              * default: 10 looping VUs for 10s (gracefulStop: 30s)


running (01.0s), 10/10 VUs, 0 complete and 0 interrupted iterations
default   [  10% ] 10 VUs  01.0s/10s

running (02.0s), 10/10 VUs, 0 complete and 0 interrupted iterations
default   [  20% ] 10 VUs  02.0s/10s

running (03.0s), 10/10 VUs, 0 complete and 0 interrupted iterations
default   [  30% ] 10 VUs  03.0s/10s

running (04.0s), 10/10 VUs, 0 complete and 0 interrupted iterations
default   [  40% ] 10 VUs  04.0s/10s

running (05.0s), 10/10 VUs, 0 complete and 0 interrupted iterations
default   [  50% ] 10 VUs  05.0s/10s

running (06.0s), 10/10 VUs, 0 complete and 0 interrupted iterations
default   [  60% ] 10 VUs  06.0s/10s

running (07.0s), 10/10 VUs, 0 complete and 0 interrupted iterations
default   [  70% ] 10 VUs  07.0s/10s

running (08.0s), 10/10 VUs, 0 complete and 0 interrupted iterations
default   [  80% ] 10 VUs  08.0s/10s

running (09.0s), 10/10 VUs, 0 complete and 0 interrupted iterations
default   [  90% ] 10 VUs  09.0s/10s

running (10.0s), 10/10 VUs, 0 complete and 0 interrupted iterations
default   [ 100% ] 10 VUs  10.0s/10s

running (11.0s), 10/10 VUs, 0 complete and 0 interrupted iterations
default ↓ [ 100% ] 10 VUs  10s

running (12.0s), 10/10 VUs, 0 complete and 0 interrupted iterations
default ↓ [ 100% ] 10 VUs  10s

running (13.0s), 10/10 VUs, 0 complete and 0 interrupted iterations
default ↓ [ 100% ] 10 VUs  10s

running (14.0s), 10/10 VUs, 0 complete and 0 interrupted iterations
default ↓ [ 100% ] 10 VUs  10s

running (15.0s), 10/10 VUs, 0 complete and 0 interrupted iterations
default ↓ [ 100% ] 10 VUs  10s

running (16.0s), 10/10 VUs, 0 complete and 0 interrupted iterations
default ↓ [ 100% ] 10 VUs  10s

running (17.0s), 10/10 VUs, 0 complete and 0 interrupted iterations
default ↓ [ 100% ] 10 VUs  10s

running (18.0s), 10/10 VUs, 0 complete and 0 interrupted iterations
default ↓ [ 100% ] 10 VUs  10s

running (19.0s), 10/10 VUs, 0 complete and 0 interrupted iterations
default ↓ [ 100% ] 10 VUs  10s

running (20.0s), 10/10 VUs, 0 complete and 0 interrupted iterations
default ↓ [ 100% ] 10 VUs  10s

running (21.0s), 10/10 VUs, 0 complete and 0 interrupted iterations
default ↓ [ 100% ] 10 VUs  10s

running (22.0s), 10/10 VUs, 0 complete and 0 interrupted iterations
default ↓ [ 100% ] 10 VUs  10s

running (23.0s), 10/10 VUs, 0 complete and 0 interrupted iterations
default ↓ [ 100% ] 10 VUs  10s

running (24.0s), 10/10 VUs, 0 complete and 0 interrupted iterations
default ↓ [ 100% ] 10 VUs  10s

running (25.0s), 10/10 VUs, 0 complete and 0 interrupted iterations
default ↓ [ 100% ] 10 VUs  10s

running (26.0s), 10/10 VUs, 0 complete and 0 interrupted iterations
default ↓ [ 100% ] 10 VUs  10s

running (27.0s), 10/10 VUs, 0 complete and 0 interrupted iterations
default ↓ [ 100% ] 10 VUs  10s

running (28.0s), 10/10 VUs, 0 complete and 0 interrupted iterations
default ↓ [ 100% ] 10 VUs  10s

running (29.0s), 10/10 VUs, 0 complete and 0 interrupted iterations
default ↓ [ 100% ] 10 VUs  10s

running (30.0s), 10/10 VUs, 0 complete and 0 interrupted iterations
default ↓ [ 100% ] 10 VUs  10s

running (31.0s), 10/10 VUs, 0 complete and 0 interrupted iterations
default ↓ [ 100% ] 10 VUs  10s

running (32.0s), 10/10 VUs, 0 complete and 0 interrupted iterations
default ↓ [ 100% ] 10 VUs  10s

running (33.0s), 10/10 VUs, 0 complete and 0 interrupted iterations
default ↓ [ 100% ] 10 VUs  10s

running (34.0s), 10/10 VUs, 0 complete and 0 interrupted iterations
default ↓ [ 100% ] 10 VUs  10s

running (35.0s), 10/10 VUs, 0 complete and 0 interrupted iterations
default ↓ [ 100% ] 10 VUs  10s

running (36.0s), 10/10 VUs, 0 complete and 0 interrupted iterations
default ↓ [ 100% ] 10 VUs  10s

running (37.0s), 10/10 VUs, 0 complete and 0 interrupted iterations
default ↓ [ 100% ] 10 VUs  10s

running (38.0s), 10/10 VUs, 0 complete and 0 interrupted iterations
default ↓ [ 100% ] 10 VUs  10s

running (39.0s), 10/10 VUs, 0 complete and 0 interrupted iterations
default ↓ [ 100% ] 10 VUs  10s
time="2026-02-23T15:30:32-03:00" level=error msg="ReferenceError: check is not defined\n\tat file:///C:/Users/New%20User/.gemini/antigravity/scratch/bytoken-k6-test/tests/load-test.js:56:14(58)\n\tat go.k6.io/k6/internal/js/modules/k6.(*K6).Group-fm (native)\n\tat default (file:///C:/Users/New%20User/.gemini/antigravity/scratch/bytoken-k6-test/tests/load-test.js:41:10(17))\n" executor=constant-vus scenario=default source=stacktrace
time="2026-02-23T15:30:32-03:00" level=error msg="ReferenceError: check is not defined\n\tat file:///C:/Users/New%20User/.gemini/antigravity/scratch/bytoken-k6-test/tests/load-test.js:56:14(58)\n\tat go.k6.io/k6/internal/js/modules/k6.(*K6).Group-fm (native)\n\tat default (file:///C:/Users/New%20User/.gemini/antigravity/scratch/bytoken-k6-test/tests/load-test.js:41:10(17))\n" executor=constant-vus scenario=default source=stacktrace

running (40.0s), 08/10 VUs, 2 complete and 0 interrupted iterations
default ↓ [ 100% ] 10 VUs  10s


  █ THRESHOLDS 

    http_req_duration
    ✗ 'avg<400' avg=19.82s
    ✗ 'p(95)<800' p(95)=33.18s

    http_req_failed
    ✓ 'rate==0' rate=0.00%

    login_success_rate
    ✗ 'rate>0.99' rate=0.00%


  █ TOTAL RESULTS 

    checks_total.......: 4      0.099998/s
    checks_succeeded...: 50.00% 2 out of 4
    checks_failed......: 50.00% 2 out of 4

    ✓ status is 200 or 302
    ✗ redirected to dashboard
      ↳  0% — ✓ 0 / ✗ 2

    CUSTOM
    login_duration.................: avg=3.4s   min=3.02s med=3.4s   max=3.78s  p(90)=3.7s   p(95)=3.74s 
    login_success_rate.............: 0.00%  0 out of 2

    HTTP
    http_req_duration..............: avg=19.82s min=3.02s med=32.16s max=33.26s p(90)=32.67s p(95)=33.18s
      { expected_response:true }...: avg=19.82s min=3.02s med=32.16s max=33.26s p(90)=32.67s p(95)=33.18s
    http_req_failed................: 0.00%  0 out of 18
    http_reqs......................: 18     0.449991/s

    EXECUTION
    iteration_duration.............: avg=39.35s min=39.3s med=39.35s max=39.4s  p(90)=39.39s p(95)=39.4s 
    iterations.....................: 2      0.049999/s
    vus............................: 8      min=8       max=10
    vus_max........................: 10     min=10      max=10

    NETWORK
    data_received..................: 683 kB 17 kB/s
    data_sent......................: 22 kB  542 B/s




running (40.0s), 00/10 VUs, 2 complete and 8 interrupted iterations
default ✓ [ 100% ] 10 VUs  10s
time="2026-02-23T15:30:33-03:00" level=error msg="thresholds on metrics 'http_req_duration, login_success_rate' have been crossed"
